{
  "schema": "ResidualOps_SecondRunDelta/v0.1",
  "delta_id": "roe15-delta-datacapsule",
  "generated_at": "2026-05-29T14:52:57.792633+00:00",
  "vertical": "datacapsule",
  "prior_receipt_ref": "pilot_receipts/datacapsule/DATACAPSULE_PILOT_RECEIPT_SAMPLE.json",
  "new_receipt_ref": "pilot_second_runs/ROE15_SECOND_RUN_RESULT_DATACAPSULE.json",
  "feedback_ref": "pilot-feedback-sample-datacapsule-v0-1",
  "changed_findings": [
    {
      "finding_id": "datacapsule-pilot-finding-3",
      "prior_explanation": "action-use BLOCK was already present",
      "updated_explanation": "Second-run feedback added an explicit action-use denial fixture candidate while preserving the action-use BLOCK.",
      "decision_changed": false
    }
  ],
  "unchanged_findings": [
    "datacapsule-pilot-finding-1",
    "datacapsule-pilot-finding-2"
  ],
  "added_fixtures": [
    {
      "fixture_id": "datacapsule-action-use-denial-candidate-v0-1",
      "source_feedback_id": "pilot-feedback-sample-datacapsule-v0-1",
      "purpose": "exercise explicit action-use denial while staying manifest-only",
      "raw_data_included": false
    }
  ],
  "added_negative_control_candidates": [],
  "updated_explanations": [
    "Second-run feedback added an explicit action-use denial fixture candidate while preserving the action-use BLOCK."
  ],
  "updated_next_actions": [
    "keep second-run artifact local/offline",
    "preserve claim boundaries",
    "do not post, merge, deploy, publish, fetch, clone, upload, train, or call external APIs",
    "add action-use denial fixture to future DataCapsule local fixture corpus"
  ],
  "claim_boundary_changes": [],
  "decision_changes": {
    "allow_to_hold_count": 0,
    "hold_to_allow_count": 0,
    "hold_to_block_count": 0,
    "block_to_hold_count": 0,
    "block_to_allow_count": 0
  },
  "safety_rules": {
    "no_block_to_allow_without_explicit_evidence": true,
    "no_hold_to_allow_without_evidence": true,
    "no_certification_upgrade": true,
    "no_external_action_authorization": true
  },
  "unsafe_decision_upgrade_detected": false,
  "certification_upgrade_detected": false,
  "external_action_authorized": false
}
